text_content_anonymous,preconceito
Graças a Deus já votei Bolsonaro eleito com fé em Deus:Brazil::Brazil::Brazil::Brazil:,0
*Pastora disse que viu pessoas na fila de votação chorando e adorando a Deus. Que o avivamento venha sobre o Brasil!*,0
"*Amado DEUS, Poderoso Rei, estamos diante de Ti para mais uma vez implorar pelo Teu auxilio nessas eleições.*

*Sabemos que não é uma  guerra apenas nas urnas, mas no Reino Espiritual. Manda Senhor, teus anjos guerreiros para lutarem por nós nas regiões celestiais, não permita que o mal vença essa guerra. Tenha misericórdia do teu povo que sofre e clama por socorro.*

*Senhor, acampa Teus anjos guardiões ao redor das urnas eletrônicas para que não haja nenhuma fraude. Sara meu Pai, essa Nação que Te clama.*

*Dá-nos uma chance de mudança e transforma junto com este país, o coração do Teu povo. Oh, DEUS, não permita que os valores das famílias e o amor a TI sejam destruídos por pessoas que escarnecem o Teu nome. Pai querido, eu entrego o Brasil em Tuas mãos e o cubro com o Sangue de JESUS, crendo  que farás a Tua Boa, Perfeita e Agradável  Vontade, em nome do Pai, Filho e do Espírito Santo Senhor Amém!!! :smiling_face_with_halo::place_of_worship::Brazil::eagle::Brazil::face_blowing_a_kiss:*

*PASSAR AOS SEUS AMIGOS.*",0
Brasil acima de tudo e Deus acima de todos! Deus está conosco :victory_hand::victory_hand:,0
"Essa foto foi tirada a 4 anos atrás. Já já irei repeti-la , GRAÇAS A DEUS",0
"""O que é um voto ”

O voto, é uma ação que expressa um desejo pre - determinado, pela sua vontade pessoal, da certeza, da sua confiança... Como vc deve expressar seu voto,sempre olhar primeiro DEUS, família, pátria, futuro social de um povo e de uma nação como um todo...O resultado do seu voto, vai ser consequência de uma boa ou má administração..... Que você exerce, o seu direito de cidadania...
Uma boa sorte !!!",0
"*Eleitor que não estiver satisfeito ou se sentir constrangido por ser obrigado a votar na urna eletrônica pode e deve fazer constar na ata da seção sua insatisfação*

Caso você esteja nessa situação, solicite ao mesário responsável para que anote na sua frente as seguintes informações:

Eu, _____, estou sendo obrigado pela Justiça Eleitoral a votar contra a minha vontade em um equipamento inapto e incapaz de atender às exigências Legais e Constitucionais, que impõe a necessidade da contagem pública dos votos. A utilização das urnas eletrônicas sem impressoras afronta os artigos 14 e 37 da Constituição Federal, os artigos 220 e 221 do Código Eleitoral e o artigo 7º da lei 1079 1950, que criminaliza a violação do escrutinio, não estando portanto em conformidade com o ordenamento jurídico vigente no País.",0
"Pobre país. Não sou cristão, mas vejo o país como Jesus, crucificado entre 2 ladrões.",0
O fodendo valer branco,0
Vou criar um grupo conservador da bahia quem for da bahia e conservador me mande mensagem no privado,0
CONTRA FATOS NÃO HÁ ARGUMENTOS.....(A TRILOGIA DO SATANÁS)....NA SEITA DO LULA LADRÃO SÓ TEM BANDIDAGEM DESGRAÇADA......(BANDO DE VAGABUNDOS DESGRAÇADOS ACABARAM COM OS SONHOS DO POVO BRASILEIRO ROUBANDO E DESVIANDO O DINHEIRO DO POVO BRASILEIRO)........,1
"Uma campanha linda que tive a honra de divulgar aqui o trabalho de Assessoria de Imprensa dessa candidata que nunca teve cargo público mas já ajuda as pessoas no Festival Internacional de Dança de Fortaleza e outros eventos culturais pelo Ceará, na ONG Bcad e em tudo que faz.  Parabéns a todos os profissionais de envolvidos, inclusive o Fran Paulo , parceira da UP GRADE COMUNICAÇÃO que fez esse vídeo. Parabéns pela coragem de tentar renovar a política, JANNE. [USER] OBRIGADO por mais essa oportunidade :red_heart: Se Deus quiser, rumo a Assembleia Legislativa :folded_hands:",0
Dessa vez o povo não acredita nas Fake News do BOZO não. Kkkkk. Começou arranjando um PADRE FAKE. Que vergonha 01 . Kkkk.,1
"Deus nos ajude. Pra ver, é o bem contra o mau.",0
"Olha aí muié, os macumbeiros , fazendo macumba nós cemitérios pra Bolsonaro,e um bando de crente sem vergonha apoiando um macumbeiro desse",1
Eu creio eu creio eu creio sem medo de erra glórias a Deus por suas palavras,0
"Quem como Deus??
Ninguém como Deus!!
Fique tranquilo, a gente dormiu o sono dos justos porque estamos deixando Deus agir. 
O exército de São Miguel, São Rafael e São Gabriel está agindo por nós e pelo Brasil.",0
"Isso é a esquerda brasileira, virando a noite, trabalhando com as trevas em prol de candidatos que apoiam as drogas, o furto, o aborto a ideologia de gênero e aos movimentos LGBT e todos que não presta, com o único propósito de destrur a família.",1
Brasil acima de tudo e Deus acima de todos:folded_hands_light_skin_tone:,0
"Amigos,
Enquanto discutimos Eleições, Lyra, Ciro Nogueira, Bivar e ACM Neto dão GOLPE e criam o Parlamentarismo, com a União dos Partidos PP & UNIÃO, vão ser mais de 80% da Câmara e no Senado perto disso, simplesmente hoje não teremos presidente mas sim um Mamulengo nas Mãos do Centrão, acabou oposição e junto a Esquerda.",0
Graças a Deus ja fiz a minha parte. Vote agora esta nas mãos de Deus pai todo poderoso :raising_hands_medium_skin_tone::raising_hands_medium_skin_tone:,0
Vai dá certo jesus está no comando de tudo eu creio a vitória é nossa:folded_hands_light_skin_tone::raising_hands_light_skin_tone::Brazil:,0
Taí a maior prova do esquerdopata Xandão agindo novamente pra ajudar o Ladrão,1
Quando for vota tem que fiscaliza também si vê alguma coisa estranho na urna tem que denunciar,0
":police_car_light::loudspeaker::speaker_high_volume: O presidente Bolsonaro tem seu time de *candidatos militares* do seu Partido no Amazonas

Um *Dois Capitães*, um *Coronel* e um *Major* que representam lealdade, patriotismo e competência à serviço e disposição povo.

:hundred_points: *COLINHA DO TIME DO BOLSONARO NO AMAZONAS*:double_exclamation_mark:

:TOP_arrow:Santinho na ordem de votação da urna!!!

:check_mark_button: :keycap_2::keycap_2::keycap_1::keycap_0: *DEPUTADO FEDERAL* :backhand_index_pointing_right_light_skin_tone: Capitão Alberto Neto (PL)
 :check_mark_button: :keycap_2::keycap_2::keycap_0::keycap_0::keycap_0: *DEPUTADO ESTADUAL* :backhand_index_pointing_right_light_skin_tone: Major Fábio Huss (PL)
:check_mark_button: :keycap_2::keycap_2::keycap_2: *SENADOR* :backhand_index_pointing_right_light_skin_tone: Coronel Menezes (PL) 
:check_mark_button: :keycap_0::keycap_0: *GOVERNADOR* :backhand_index_pointing_right_light_skin_tone: Escolha o menos pior!!!:face_vomiting: 
:check_mark_button: :keycap_2::keycap_2: *PRESIDENTE* :backhand_index_pointing_right_light_skin_tone: Capitão Jair Bolsonaro (PL)",0
"Boa tarde gente, eu já votei, graças à Deus foi uma votação tranquila tou confiante!!",0
"Enquanto os eleitores do Bolsonaro ora a Deus pela sua reeleição, os macumbeiros eleitores do Lula, a frente do Cemitério, macumunados com o espírito do mal pedem a Vitória do Ladrão Lula e seus comparsas.

A guerra está aí, com certeza o Bem vencerá o mau.",1
O problema seu demagogo hipocrita: a bandeira do brasil   Nunca foi valorizada pelo pt..a causa desse filho puta e o foro de São Paulo e a dominação da América Latina . Quando que Lula usou o verde e amarelo nas suas campanhas? Nunca,0
"FOTOS nítidas dos Boletins das URNAS de todo o Brasil, com todas as páginas, deverão ser enviadas para o perfil acima,  criado pelos Grupos de Direita Conservadores do CE. Iremos fazer a apuração paralela, de forma legal e necessária. Favor divulgar ao máximo rapidamente.",0
Acabei de ver um aqui do predio com boné do MST e a esposa com blusa do Luladrão affff,1
"*Viva a festa da democracia!*

O grande dia chegou e é sempre uma grande emoção. Exerci minha cidadania votando logo cedo na Unimontes, universidade em que me formei. O meu sentimento é de dever cumprido. Fiz a minha parte! E não há nada mais sagrado em uma democracia do que o voto. Aguardo agora com muita alegria e expectativa o resultado nas urnas. Sigo confiante. Que Deus abençoe a todos nós e que seja feito o melhor para o Brasil e para o nosso Estado. Minas Gerais, Norte de Minas, estou pronto!

*ARLEN SANTIAGO :keycap_7::keycap_0::keycap_1::keycap_1::keycap_1::check_mark_button::rocket:*",0
Não adianta inventar pq nós vamos ganhar em nome de Jesus,0
Mas leonardo sempre foi assim des do tempo que trabalhava com pessoal do Ronaldo lessa mas Deus abençoe ele hoje to longe de meu estado mas feliz em ver pessoas de bem na luta por um brasil melhor,0
Lula mandou na levantar bandeira vermelha bolsonaro mandou nós levantar bandeira do nosso país caso verde amarelo branco olha diferença de um candidato porto vocês nunca viram o lula balançando uma bandeira do brasil,0
"A juventude na sua grande maioria votando em Lula
Só Deus para salvar essa nação.",0
"Quem mora fora é rico. 

Gente que ganhou dinheiro só na época lula!",0
"Agora terminou de acabar com o GP 
Com mais uma desgraça  aparecendo.
Esse ai é o segundo bolsonario um cão em forma de pessoa.
Deus nos livre dessas maldições",0
"rapaz foi bom viu, gente tinha era lá homem tu é doido",0
Olha o choro da esquerda :grinning_face::grinning_face::grinning_face::grinning_face:,0
Deus mandando um sinal.:folded_hands_light_skin_tone:,0
"Traidores da pátria!

Mil cairão ao teu lado, e dez mil, à tua direita, mas tu não serás atingido.",0
"Vc tem que falar que gay é um ser humano, gay quer ser tratado diferente. Quer ter direitos especiais. Tem uma página no insta que se chama gays com Bolsonaro. O gay não precisa da vitimização dos governos esquerdistas para usufruir dos direitos deles como cidadãos",1
"Ué, a petezada daqui copiou nós. Lá na escola onde eu votei tinha gente de vermelho.",1
E se gay se sente vítima de crimes. Pq nesses mais de 20 anos de psdb e pt não houve a criação de uma lei que tornasse homofobia crime hediondo e inafiançável?,1
"Pessoal, eu sou de direita, e venho aqui dizer que concordo com algo que o Felipe Neto disse.",0
"Pergunta o que acham das falas homofóbicas do lula, quando ele disse la grelo duro, exportadora de viado",1
Peço desculpas pelos palavrões pois meu filho é seguidor de bolsonario até o fim e 22,0
"Votação em Lisboa está o caos, não se consegue encontrar o fim da fila e o processo está extremamente lento.",0
"A noite, encerram as votações as 17, tem a lacracao das urnas e o envio aos fóruns para contagem",0
PESQUISAS DE BOCA DE URNA CONFIRMAM É É É É BOLSONAROOOOOOOO EM PRIMEIRO TURNO COM MAIS DE 90 MILHÕES DE VOTOS PARA DESESPERO DA ESQUERDALHA AMALDIÇOADA DOENTIA E FEDORENTAA,1
"Top ,será se a fonte é verdadeira meus amigos. 
Com fé em Deus",0
Galera vamos espera que um.coisa e certa a vitória será do bem será de bolsonaro com fé em Deus,0
":backhand_index_pointing_up: *A voz do povo é a voz de Deus: Resposta do Brasileiro ao Sr. PACHECO.* :relieved_face:*  :thumbs_up::thumbs_up::winking_face::winking_face::winking_face::Brazil::Brazil::Brazil::Brazil::Brazil::Brazil::Brazil::Brazil::Brazil::Brazil::Brazil::Brazil::Brazil::Brazil::Brazil::Brazil::Brazil::Brazil::Brazil::Brazil:

Canal
[USER]:Brazil:",0
Verde pela esperança e amarelo representa o quanto nosso Brasil é rico,0
":backhand_index_pointing_up: RODRIGO PACHECO MALDITO TRAIDOR , MERECIA ALGO PIOR QUE UMA VAIA , POVO DE MINAS NÃO MERECE ESSE TRASTE ....",0
Votei agora a pouco. Tudo ok tbm. Graças a Deus. :Brazil::keycap_2::keycap_2:,0
Qap senhores:loudspeaker: eu vinha chegando no montese antes da igrejinha de nossa senhora e dois tan no carro botou o carro por cima de me sem motivo acho que pq estava com a bandeira do Brasil e camisa do Bolsonaro ( placa pmc 2383 Fiat uno brata,0
Hj em nome de Jesus venceremos o mal poderemos dizer Lula nunca mais,0
"AVISO!!! SE O BOLSONARO GANHAR O PAI VAI FICAR CHATÃO 
Pode bloquear 
Xingar 
Eu vou perseguir petista até por ligação e sms 
O choro e livre petralha",1
*NÃO VAMOS SAIR DA FILA SEM VOTAR O POVO TA ACHANDO QUE  ONDE O BOLSONARO TEM A MAIORIA COLOCARAM O SISTEMA LENTO POR ISSO NÃO VAMOS DEIXAR DE VOTAR*,0
"Olham só a diretora da escola entregando os santinhos da esquerda na fila de votação no dia das eleições, favor alguém pode entregar essa pilastra da diretora para a justiça!",0
Portugal está com problemas nas urnas fora o horário Que foi estendido para as 20 hrs o encerramento das eleições. MUITO ESTRANHO ISSO TUDO.  Porque será que só em Portugal está havendo problema nas eleições brasileiras :thinking_face::thinking_face::thinking_face:,0
"Sou BOLSONARO!
Se esse tipo de manisfesto continuar acontecendo vai ficar feio pra nós
Gente nós somos diferentes da esquerda
Nós pregamos paz, amor, liberdade...",0
"Eu estou trazendo esse plint após um comentário de um vídeo de um bando de macunbeiros fazendo seus despacho na frente de um cemitério. Porque estou fazendo isso no meu plint fala que Deus não dorme e esse noite ouve muitos louvores lave e anite teremos sim um resultado muito positivo vou trazer pra vcs verem o que se falou na lave foi puro fogo :fire: de Deus aguardem.após o resultado, mas já adiantando um pouquinho teremos prisões :zipper-mouth_face:",1
"Pensarão ganhar na pressão mas sabemos fazer conta 
Gratos a Deus primeiro e ao presidente e FFAA pela nossa ainda que machucada mas respirando forte liberdade",0
É verdade que não Europa o Luladrão está na frente ? :crying_face:,1
"PESSOAL NA ESCOLA JOÃO GUIAO DE RIBEIRÃO PRETO, ESTÁ DANDO NOVIDADE NA VOTAÇÃO
NÃO CONFIRMA BOLSONARO E QUEM RECLAMA MANDAM FAZER BO NA DELEGACIA.",0
"*_É HOJE NO PRIMEIRO TURNO PELA PRIMEIRA VEZ NA HISTÓRIA SE DEUS QUISER! DEUS OLHAI POR NOSSA NAÇÃO! QUE O COMUNISMO JAMAIS IMPERE NO NOSSO PAÍS! DEUS PÁTRIA,FAMÍLIA E LIBERDADE! BRASIL ACIMA DE TUDO,DEUS ACIMA DE TODOS!_* :place_of_worship::folded_hands_light_skin_tone::keycap_2::keycap_2::Brazil:",1
"Meu Deus, é muito amor pelo nosso país !
Que Deus continue lhe abençoando :folded_hands::folded_hands::folded_hands:",0
"Zoe Martinez anuncia ao vivo na Jovem Pan que Cubra já está nas ruas comemorando a vitória e Lula.
Estranho, não?",0
"A TAMMY QUER SER HOMEM, O PABLO EVITAR, QUER SER MULHER, O LADRÃO DE 19DEDO QUER SER HONESTO E NÓS SOMOS OBRIGADOS A ENGOLIR, AGORA O CARA QUER SER PADRE E A ESQUERDA DIZ QUE ELE NÃO É. VÃO SER PROCESSADOS POR PADROFOBIA.",1
Olhem o que o luladrao fala de nós bolsonaristas.,1
E normal mentir da sua parte né? Vcs já estão acostumados!:rolling_on_the_floor_laughing:,0
Meu Deus!!!! E o que acontece com os votos do dia todo nessa urna fraudada? Serão computados? Para o pt?,0
Esse povo doido lá de fora quer que o Brasil fique pior?,0
Mas como assim já até reservaram a paulista ?! Tem algo estranho,0
"Votem! Cada voto conta! Vamos salvar o Brasil, o nosso futuro, as nossas crianças!   Enfrentem a fila que for preciso, mas não se omitam! Em vários países a esquerda ganhou por conta da abstenção de muitos. Sejamos conscientes! Deus abençoe o nosso Brasil! :Brazil::Brazil::Brazil:",0
Tomara Deus pelo que vi nas ruas hoje confesso que tenho muito medo,0
"MORAES ACABA DE DIZER QUE AS FILAS SÃO NORMAIS.
Tem notícias de filas absurdas no Brasil inteiro, mas o Presidente do TSE diz que isso é normal e a culpa não é da biometria.
VOCÊ JÁ ENFRETOU FILAS ASSIM EM OUTRAS ELEIÇÕES?",0
"Marcola lider do PCC declara apoio a Lula e ainda faz um elogio: mesmo Lula sendo um pilantra e um 0 à esquerda, para a nossa causa ele é melhor que Bolsonaro",0
"Com isso claro que as pessoas buscam as maneiras mais fáceis para suprir isso

Como ter terras e outras estratégias",0
"Eita , como uma pessoa que diz que defende Deus , posta uma mentira dessa .",0
":warning::warning:Venezuelanos passam *_Fome em Fortaleza*_ Que triste não vote em candidato de esquerda que querem implantar o socialismo no Brasil.

*_#Fora Lula_*
*_# Fora Elmano*_

Brasil acima de Tudo e DEUS Acima de Todos :Brazil::Brazil::Brazil::Brazil::raising_hands_light_skin_tone:

[USER]",0
"Pior que ele disse, mesmo.

Usou o exemplo do jogo Internacional & Corinthians, de 1976, quando o Internacional ganhou com GOL ILEGAL (bola na trave e depois fora do gol) que o árbitro deu como GOL LEGAL.",0
"Leva nossos problema para fora

 Cartazes da cara de  Lula e Bolsonaro 

Roupa suja se lava em casa não é levar para os outros",0
"O modo como os homessexuais são tratados pela mídia muitas vezes é desnecessário, o cidadão precisa ser tratado com caráter assim como os demais",0
No meu caso tambem foi bem parecido... votei normal encerrei a votação  e talss.. mas disseram que nao precisava  assinar.. pq minha biometria funcionava. :thinking_face:,0
"Boa tarde, complexo de vira lata, acho a minha pátria e o Brasil, portanto, boa ou ruim é o meu lugar, puxar saco de americano não vai resolver nada, precisamos corrigir nossos defeitos , e parar de achar que o Brasil só tem coisa ruim, ou vcs acham que na América não te favela, não tem fome, não tem corrupção, claro que tem, só não fazem propaganda da desgraca igual nos",0
Aaaffffff. É porque querem complicar mesmo a gente. Mais Deus é mais sempre :clapping_hands_light_skin_tone::clapping_hands_light_skin_tone::oncoming_fist::oncoming_fist::handshake::handshake::folded_hands::folded_hands::folded_hands:,0
"O país é laico  . Lula não vive com o nome Deus usando na boca. Como vejo certo candidato fala o nome Deus , mas , rouba , mente , debocha de quem morreu pela COVID ( sem empatia cristã ) , tem várias mulheres e divórcios , onde o cristianismo proibi o divórcio . E tanta merda ...  E ainda adora imagem que minha vó diz que quem adora imagem tá adorando o satanás .",0
"Isso é sério, más Deus tá com agente, e eles não vão tomar o poder não :folded_hands:",0
Até a justiça eleitoral tem a cor preferida :Brazil::Brazil:,0
"Não somos coveiro mas, hj faremos o enterro do Bozo.:coffin:

Velório aberto ás 17hs.",1
"*:sparkle::mobile_phone_with_arrow:Compro celular danificado com tela quebrada ou queimada:mobile_phone:*com* boas procedencia
:cross_mark::cross_mark::cross_mark::cross_mark::cross_mark::cross_mark::cross_mark::cross_mark:
 Que esteja com placa mãe funcionando:check_mark_button: 
*Motorola*
Motog 2 , 3 , 4 , 5 , 6
Moto e 1, 2, 4 
Moto x 1,2 
Moto z
Moto x play
*Azus*
Zefone 1,2,3,4,Go
*LG*
K4, k8, k10
L70,L90, G6, G7
*SAMSUNG *
J5, J7 NORMAL DOURADO, METAL
J2 PRIME,J5 PRIME, J7 PRIME,
J5 pro. J7 pro 
A01 a10 a20 a30 etc
M10 m20 a70 a31 
*XIAOME E IPHONE*
GRAM PRIME, GRAM DUOS
:cross_mark::cross_mark::cross_mark::cross_mark::cross_mark::cross_mark::cross_mark::cross_mark:
:sparkle:Preço acessivo, sem preços abusivos :sparkle:
*Se você tem é quer desfazer  chama no pv*",0
"Estou em uma churrascaria e vendo uns filhos da puta do mst aqui com boné de lula, chega dar nojo",1
DILMA ATRAPALHANDO A VOTAÇÃO :backhand_index_pointing_up::backhand_index_pointing_up::rolling_on_the_floor_laughing::rolling_on_the_floor_laughing::rolling_on_the_floor_laughing::rolling_on_the_floor_laughing::rolling_on_the_floor_laughing:TÁ ATÉ AGORA PROCURANDO O MOUSE PRA CLICAR :rolling_on_the_floor_laughing::rolling_on_the_floor_laughing::rolling_on_the_floor_laughing::rolling_on_the_floor_laughing:SAI DAI BURRA  DO CARALHO,1
"O mais importante será nossa vitória meus irmão patriotas .
Deus a frente sempre",0
"Ele não pode nada,quem pode tudo é o nosso Deus, vamos confiar em Deus",0
"Vamos orar , Deus fará maravilhas no meio do povo , se Deus eh por nós quem será contra nós :raising_hands:",0
"O presidente se reelegendo, vai criar condições para a direita ficar pelo l seis mandatos cuidando do país:Brazil:",0
O sangue de Jesus tem poder e ele vai defender seus filhos dessa besta fera.,0
Ei de ver Bonner falar que Bolsonaro está reeleito! Em nome de Jesus!!! :folded_hands_light_skin_tone::folded_hands_light_skin_tone::folded_hands_light_skin_tone::folded_hands_light_skin_tone::folded_hands_light_skin_tone:,0
Países mais fortes porque a esquerda corrupta esteve por mais de  três décadas no poder e sucateou as FFAA.:rat::rat::rat:,0
Jesus q ansiedade minha neta de 8 anos tá num nervoso. :woman_facepalming:,0
Com todo respeito cidadão.  Chamar alguém de mentiroso é meio ovo. Olha direito.  Site do TSE,0
Devia ter mandado uma bomba ao invés de água praquele povo.,0
"Deus da o livre arbítrio, temos o bem e o mal temos que saber escolher",0
Final dos trabalhos contribuindo com a justiça eleitoral. Trabalhei com uma equipe maravilhosa. Obrigado meu Deus.,0
"Tem gente aqui no Estado do Espírito Santo, que vota no presidiário Luladrão.",1
"Essa diferença vai aumentar,  se Deus quiser vai ser primeiro turno :folded_hands:",0
"Infelizmente ela será um nome forte no futuro. E o trabalho dela na CPI foi omisso, tendencioso e de esquerda. Mostra um caráter ao meu ver mais do mal do que do bem.",0
"Gente quem estiver em sua residência sobre seu joelho e ore pelo nosso Brasil e pelo nosso presidente. Mancumbeiros de toda parte fazendo rituais para destruir o nosso presidente... Vamos entrar na guerra tbm, o nosso Deus é o nosso general de guerra... :folded_hands::folded_hands::folded_hands::folded_hands::folded_hands::folded_hands::folded_hands::Brazil::Brazil::Brazil::Brazil::Brazil::Brazil::Brazil::Brazil:",0
Bolsonaro é mesmo o instrumento de Deus por isso o altíssimo deu a Vitória para o nosso presidente,0
"*CONVOCAÇÃO DO GENERAL AUGUSTO HELENO* 

*PATRIOTAS DO BRASIL:Brazil::Brazil::Brazil:*

*Convoco todos os patriotas do Brasil a comparecer novamente na sua zona eleitoral  depois das 16 horas e permanecer dentro das dependências do local em que você votou até as 17 horas, pois é quando é colado o boletim da urna na porta da seção, então tire foto do  BOLETIM de URNA = BU*

O Boletim de urna é o documento emitido em cada seção eleitoral com o resumo da votação daquela seção, é como um extrato de todos os votos.

Naturalmente se vc quiser pode tirar a foto do BU na porta  das demais seções do lugar onde você votou.

*Com essas fotos vamos ter documentado toda a votação no Brasil e vamos impedir fraude nas eleições de 2022.*

*Divulguem essa mensagem é importante!*

*O BRASIL É NOSSO!*

*Boa votação a todos os homens e mulheres de bem desse país!*

*BRASIL ACIMA DE TUDO. DEUS ACIMA DE TODOS!!!*",0
Vai ser no primeiro minha querida em nome de Jesus :folded_hands:,0
"4. Bem-aventurado aquele a quem tu escolhes, e fazes chegar a ti, para habitar em teus átrios! Nós seremos satisfeitos com a bondade da tua casa, do teu santo templo.
5. Com prodígios nos respondes em justiça, ó Deus da nossa salvação, a esperança de todas as extremidades da terra, e do mais remoto mar;
6. tu que pela tua força consolidas os montes, cingido de poder;
(Salmos, 65)",0
":thinking_face: Jesus Disse: a minha Paz vos dou, não vo-la dou, como o mundo a dá., não se turbe o vosso coração,nem  se atremorise:backhand_index_pointing_right_medium_skin_tone:João.14.27",0
Qualquer resultado: Deus e Deus dessa nação e temos fé e quem tem fé tem esperança a nossa esperança está no Senhor,0
"Você que tem que aceitar que os nordestinos não aprendem nunca a votar.
Respeite a opinião dos outros,eu sou nordestina e posso falar o que quiser.",1
Ninguém está desrespeitando o nordeste. Só estamos constando que é sempre no nordeste que o Luladrão ganha disparado. O que acontece com o nordestino que ainda não aprendeu a votar? :face_with_rolling_eyes:,1
Eu fiz uma promessa com Deus se Bolsonaro ganhar nunca mais eu provo em bebida alcoólica menos o vinho da semana santa,0
"Sera que vai ter a tal ""falha apagão"" na sala ""secreta"" nos percentuais decisivos? OLHO VIVO, A ESQUERDA ESTÁ DESESPERADA",0
Gente!! Está claro que fraudaram as eleições. Não acredito no percentual do Lula. Estão forçando um segundo turno,0
Às vezes precisa acontecer algo assim para o espírito da indignação do Senhor encher nossos corações e irmos às ruas protestar e assim esse STF ser definitivamente ser limpo,0
"Aí esse Lula e quem votou no vão tudo para os quinto dos infernos

Quem vota num vagabundo de um ladrão velho desse cabeça branca não tem cérebro não é de outro planeta.",1
"Tá chegando a hora de Deus nos libertar dessa praga.
Só trouxe desgraça para o Brasil.
Ainda tem jente da mesma laia q vota num cão desse",0
Esse ai se ficasse ia acabar com a nação brasileira menos os babão dele,0
"É a luta do bem contra o mal, mais do que Deus ninguém :folded_hands_light_skin_tone::raising_hands_light_skin_tone:",0
"Em boa parte existem pessoas mais leigas, o que é uma lástima. Mas infelizmente muitos ainda não enxergam que o PT só usa boa parte como massa de manobra, mas aqui ainda tem muita gente que deseja expurgar esse mal daqui. Obs, parem de chingar os nordestinos, outra coisa, sou do extremo Sul da Bahia e aqui a maioria são Bolsonarista. Grata!",0
"QUANDO O TSE FICA FAZENDO PAUSA E NÃO  ATUALIZA PODE ESPERAR A FRAUDE.
O LULADRÃO SOBE AOS POUQUINHOS E O BOLSONARO CAI AOS POUQUINHOS PARA NÃO GERAR DESCONFIANÇA",1
Gente é apenas minha opinião porque se dá uma opinião mais severa você pode até ser preso eu tenho certeza que bolsonaro ganha isso aí no primeiro turno se não for me desculpa falar cara foi muito lindo de ver hoje em todos os estados tinha negro xingando o presidente do congresso Rodrigo Pacheco eu vi nego xingando aonde Sayonara foi votar eu vi as pessoas chamando aquela tal de taba tabaca sei lá que ele é xingando ela,0
"Com meu marido ainda tava a digital coletada sem ele coletar, falaram que o TSE pegou nos bancos de dados dele, eu achei estranho",0
